SEARCH_ROW,PUBLICATION,DATE,TITLE,EDITION,BYLINE,LANGUAGE,COUNTRY,SECTION,STATE,JOURNAL-CODE,PUBLICATION-TYPE,LENGTH,LOAD-DATE,DATELINE,SUBJECT,TEXT
29,AE Noticiário,10 Junho 2014,Blatter pede fim de todos os confrontos durante a Copa,,Jamil Chade,PORTUGUESE; PORTUGUÊS,,ESPORTES,São Paulo,FASTNEWS,Boletim de notícias,494 palavras,"June 10, 2014",,,"Diante de manifestações, protestos e greves, o presidente da Fifa, Joseph Blatter, apela para que todos os confrontos sejam suspensos durante a Copa do Mundo. Na abertura do congresso anual da entidade, Blatter lançou o pedido, insistindo que ""o mundo perturbado"" precisava receber as ""emoções do futebol"". O evento foi totalmente esvaziado pela classe política brasileira, que deixou a Fifa praticamente sozinha em seu maior evento político do ano. Nesta terça-feira, em São Paulo, a entidade abriu seu congresso anual. Mas o clima de crise interna na Fifa, os protestos, e a ausência das autoridades políticas e até mesmo de craques abafavam o som de samba da festa montada pelos organizadores. Blatter, por sua vez, pediu que os convidados apenas aproveitassem a Copa e que deixassem ""as discussões"" para outro dia. O cartola pediu ""respeito"" e que, durante o evento, ""todas as atividades beligerantes parem para ver o futebol e para que se construa pontes"". Na Fifa, as manifestações no Brasil são consideradas como a maior ameaça à Copa. A greve dos metroviários em São Paulo, nos últimos dias, deixou a entidade alarmada e o temor é de que novos protestos ocorram a partir de quarta-feira. Em uma mensagem enviada pela presidente Dilma Rousseff, ela garantiu que ""o Brasil está pronto para a Copa das Copas"". Mas o único representante do governo federal foi Aldo Rebelo, ministro do Esporte. Nem o governador Geraldo Alckmin e nem o prefeito Fernando Haddad estiveram no evento. Apesar de o Mundial ocorrer em doze sedes, apenas o governador do Distrito Federal, Agnello Queiroz, esteve presente. As baixas no lado do futebol também foram importantes e, entre os ex-craques brasileiros, Ronaldo era um dos poucos na sala. João Havelange, ex-presidente da Fifa, também não apareceu. Além de ter sido internado nesta semana por uma gripe, o ex-cartola abandonou a Fifa depois de um escândalo de corrupção. Rebelo, que leu uma mensagem da presidente Dilma Rousseff, repetiu o mantra do governo de que a Copa deixará um legado de infraestrutura ""moderna"" para a população. ""Trabalhamos pela Copa, tanto quanto queremos ganhá-la"", disse. Mas ela ainda mandou um recado ao mundo do futebol, criticando seleções que nacionalizam jogadores brasileiros para atuar por seus times. ""O Brasil tem consciência de que deu uma enorme contribuição para que o futebol seja o esporte mais popular do planeta"", disse. ""Nossos craques povoam os campos do mundo, a peso de ouro a ponto que países os nacionalizam para suas seleções. Isso já causa preocupação e merece atenção do presidente Blatter"", disse a mensagem de Dilma, lida por Aldo Rebelo. Se os políticos evitam Blatter, o cartola suíço e candidato a um novo mandato como presidente em 2015 ganhou um cabo eleitoral de peso: Fernanda Lima. A apresentadora, que uma vez mais chamou a atenção em um evento da Fifa, não economizou elogios ao presidente da Fifa. ""Ele conduziu com sucesso a Fifa desde 1998"", declarou a modelo."
30,AE Noticiário,11 Junho 2014,ONG Internacional critica 'intimidação a manifestantes',,Felipe Werneck,PORTUGUESE; PORTUGUÊS,,GERAL,Rio,FASTNEWS,Boletim de notícias,502 palavras,"June 11, 2014",,,"A Anistia Internacional divulgou nota na tarde desta quarta-feira (11) em que demonstra preocupação com iniciativas da Secretaria de Segurança do Rio que ""possam intimidar manifestantes"" durante a Copa do Mundo. No documento, a ONG também questiona decisão da Fifa de negar trânsito livre para a Defensoria Pública em locais de competição como o estádio do Maracanã. Na manhã desta quarta, dez pessoas foram levadas por agentes da Delegacia de Repressão aos Crimes de Informática (DRCI) do Rio para ""prestar esclarecimentos"" sobre supostos atos de violência ocorridos durante protestos em 2013. ""A Anistia Internacional espera que, durante o período dos jogos, manifestantes não sofram qualquer tipo de intimidação ou represália. A liberdade de expressão e manifestação pacífica são um direito humano e devem ser garantidos pelo Estado brasileiro durante a Copa"", escreveu o diretor executivo da entidade no País, Atila Roque. A nota cita o caso da ativista Elisa Quadros, conhecida como Sininho, que foi levada à Cidade da Polícia, na zona norte do Rio, às 7 da manhã. Na tarde desta quarta, ela prestaria depoimento em audiência na Auditoria da Justiça Militar no processo que o major Fábio Pinto Gonçalves e o primeiro tenente Bruno César Andrade Ferreira respondem por constrangimento ilegal - em setembro de 2013, os dois foram flagrados em vídeo forjando um flagrante de posse de explosivo contra um manifestante. No Rio, nenhum PM foi julgado desde junho, apesar das denúncias de violência policial na repressão aos protestos. A ação da Polícia Civil do Rio ocorreu um dia antes da abertura da Copa do Mundo. Estão programadas duas manifestações para esta quinta-feira no Rio, no centro, pela manhã, e em Copacabana, à tarde. A operação da DRCI tinha o objetivo de cumprir 17 mandados de busca e apreensão, expedidos pela 27.ª Vara Criminal. A Anistia Internacional também informa na nota que, às vésperas da Copa, vê com preocupação a negativa da Fifa em conceder trânsito livre à Defensoria Pública. ""Em razão de protocolos realizados entre a Federação, o Conselho Nacional de Justiça (CNJ) e o Conselho Nacional do Ministério Público (CNMP), foram disponibilizadas credenciais de trânsito livre apenas a magistrados e membros do Ministério Público. Para a Anistia Internacional, esta negativa compromete a garantia do direito à assistência jurídica plena e a prevenção de eventuais abusos ou violações de direitos. Nesse sentido, a organização solicita que esta autorização seja imediatamente concedida à Defensoria Pública em todos os estados que irão receber o mundial."" O diretor executivo da ONG afirma esperar que ""todas as violações de direitos humanos sejam investigadas de forma célere e transparente e devidamente responsabilizadas"". ""A Copa do Mundo começa amanhã e esperamos que medidas que possam comprometer o direito de defesa de participantes dos protestos sejam imediatamente revertidas. E que outras ações que sirvam de alguma forma para intimidá-los sejam interrompidas"", escreveu Atila Roque."
31,AE Noticiário,12 Junho 2014,Movimento de protesto contra a Copa em BH foi fraco,,"Alex Capella, especial para O Estado",PORTUGUESE; PORTUGUÊS,,GERAL,Belo Horizonte,FASTNEWS,Boletim de notícias,395 palavras,"June 12, 2014",,,"Marcado para a manhã desta quinta-feira, 12, o movimento ""Não vai ter Copa BH"" não conseguiu reunir adeptos. Na Praça Sete, no Centro da capital mineira, sob um forte esquema policial, o que se viu foi um grupo com cerca de 350 integrantes do ""Movimento Luta Popular"". Pelas redes sociais, mais de 4.500 pessoas haviam confirmado presença na manifestação do ""Não vai ter Copa BH"". Pelas redes sociais, o ""Não vai ter Copa"" pergunta aos internautas se eles ""querem ver a mudança?"", se ""querem mudar?"". Os autores do movimento convidam os internautas a sair ""de seu conforto"" a ""sacrificar seu presente em troca do futuro"". Segundo eles, com os protestos nas ruas ""todos sairão vitoriosos nessa luta que um dia terá um fim"". De acordo com um dos líderes do ""Movimento Luta Popular"", Roberto Verônica, os manifestantes exigem moradia, saúde e obras de saneamento. Eles fazem parte de uma ocupação, localizada em um terreno em Contagem, na Grande Belo Horizonte. ""Queremos um posicionamento da Prefeitura de Contagem. A presidente Dilma Rousseff nos prometeu a construção de casas para as 1.200 famílias da ocupação"", disse, confirmando que assistirá à abertura da Copa entre Brasil e Croácia. Fora o pequeno grupo reunido na Praça Sete, o que se viu em Belo Horizonte foram ruas tranquilas, com pouco trânsito, e muita gente vestida com as cores verde e amarela. Para quem circulava pelas avenidas Antônio Carlos e Catalão, principais corredores de acesso ao Mineirão e que receberam a maior parte dos protestos no ano passado, o clima era de tranquilidade, apesar do aspecto de guerra. Todas as concessionárias de veículos, praticamente todas as agências bancárias e vários postos de combustível das vias foram cobertos com contêineres empilhados, folhas metálicas e arame farpado circular. Sobre as proteções, várias faixas de ""Estamos funcionando normalmente"". ""A gente tem de se precaver. Nunca se sabe. No ano passado, os prejuízos foram grandes"", lembrou um gerente de um posto de combustível, que preferiu não ter o nome revelado. Em muitas estações do recém-inaugurado sistema de BRT (corredores exclusivos de ônibus), o policiamento foi reforçado pela Polícia Militar e Guarda Municipal. Dezenas de viaturas da PM Rural também circulam pela cidade, com um adesivo de ""Batalhão Copa"". A polícia montada reforçou o patrulhamento no Centro da cidade, em especial na Praça Sete."
32,AE Noticiário,12 Junho 2014,Manifestantes entram em confronto com a polícia em BH,,Marcelo Portela e Suzana Inhesta,PORTUGUESE; PORTUGUÊS,,GERAL,Belo Horizonte,FASTNEWS,Boletim de notícias,328 palavras,"June 12, 2014",,,"Manifestantes e policiais militares protagonizaram um princípio de confronto durante manifestação em Belo Horizonte. O protesto, que conta com cerca de 300 pessoas, segundo a Polícia Militar (PM), começou de forma pacífica no início da tarde, mas quando os manifestantes se aproximaram do relógio da Copa, na Praça da Liberdade, um grupo começou a atirar rojões em direção ao cerco policial montado em volta da estrutura. Os militares revidaram com bombas de efeito moral. Houve muita correria, mas até o meio da tarde não havia registro de prisões ou feridos. Segundo o chefe do Comando de Policiamento Especializado (CPE) da PM, coronel Ricardo Machado, duas pessoas foram presas na região próxima à Praça Sete de Setembro, no Centro, onde houve a concentração. De acordo com o oficial, os suspeitos foram flagrados com socos ingleses e máscaras. Desde o fim da manhã, o esquema de segurança na região havia sido reforçado. O protesto foi organizado por meio de redes sociais da internet e conta com a participação de integrantes de diversas entidades sindicais e movimentos sociais, como o Comitê Popular dos Atingidos pela Copa (Copac) e Mulheres em Luta e Central Sindical Popular (CSP), entre outros. Durante todo o ato, os manifestantes exibiam faixas, cartazes e gritos contra a Copa, o governo e até pedindo a ""readmissão dos metroviários em São Paulo"" demitidos por causa da greve da categoria. ""Essa é uma coisa boa. Do jeito que foi feita (a organização da Copa), não foi uma coisa justa"", avaliou o estudante norte-americano Anderson Mayes, de 22 anos, que está na capital mineira há 29 dias em razão de um intercâmbio na Universidade Federal de Minas Gerais (UFMG) e aderiu ao protesto. Durante a concentração, manifestantes queimaram a bandeira do Brasil na Praça Sete, mas o clima no início era de festa, inclusive com um grupo batendo bola na praça e, depois, na avenida Afonso Pena, uma das principais da cidade, que teve o tráfego fechado nos dois sentidos."
33,AE Noticiário,13 Junho 2014,Alckmin: ação da PM em protesto evitou problema maior,,Fabiana Cambricoli,PORTUGUESE; PORTUGUÊS,,GERAL,São Paulo,FASTNEWS,Boletim de notícias,292 palavras,"June 13, 2014",,,"O governador de São Paulo, Geraldo Alckmin (PSDB), defendeu a ação da Polícia Militar durante o protesto contra a Copa e disse que ela foi necessária para evitar um problema maior. ""A polícia evitou situações mais graves porque estávamos na abertura da Copa, 60 mil pessoas indo para o estádio, muita gente na rua. Imagine se a Radial Leste é fechada, as pessoas não conseguem ter acesso e o caos que poderíamos ter tido com graves consequências até para a integridade física das pessoas"", disse ele na manhã desta sexta-feira, 13, em evento na capital paulista. Alckmin afirmou que a intervenção foi necessária também para controlar a invasão da Estação Tatuapé do metrô, já que muitos torcedores utilizaram esse tipo de transporte para chegar à Arena Corinthians. Foram 55 mil passageiros transportados pelo metrô e outros 30 mil pelos trens da CPTM, segundo o governador, que minimizou os casos de jornalistas e manifestantes feridos por ações da polícia. ""O direito dos jornalistas está totalmente preservado. Graças a Deus não houve incidente mais grave, todos já estão em casa. De outro lado, você tem ações muito violentas. Imagine você invadir uma estação de metrô, o principal acesso ao estádio. São situações graves que, se a polícia não agir de maneira firme, isso pode ter consequências maiores"", afirmou. Ele disse ainda que todas as ações da Polícia Militar são filmadas e que a Corregedoria vai investigar possíveis abusos de policiais. ""Excessos serão punidos. Para isso existe a Corregedoria"", disse. Questionado, o governador se negou a dar uma nota para a atuação da PM durante o protesto. ""Não é questão de dar nota A, B, C ou D. A polícia agiu, como é seu dever agir no sentido de preservar a ordem pública, evitar vandalismo"", afirmou."
34,AE Noticiário,13 Junho 2014,Ministra critica ação policial em protestos contra Copa,,Thaise Constancio,PORTUGUESE; PORTUGUÊS,,GERAL,Rio,FASTNEWS,Boletim de notícias,353 palavras,"June 13, 2014",,,"A ministra Ideli Salvatti, da Secretaria de Diretos Humanos (SDH) da Presidência da República, classificou como ""desnecessária"" e ""inadequada"" a ação policial na repressão aos protestos contra a Copa do Mundo em dez das 12 cidades-sede, nesta quinta-feira, 12, mesmo dia do jogo de abertura do Mundial. Na manhã desta sexta-feira, 13, durante apresentação das ações de enfrentamento à violência contra crianças e adolescentes na Copa do Mundo, ela citou o caso de São Paulo, onde um manifestante ""subjugado"" foi detido por policiais e recebeu spray de pimenta nos olhos. De acordo com a ministra, há um protocolo de atuação que deve ser seguido pelas forças policiais e de repressão federais, estaduais e municipais e os governos estão preparados para acompanhar ""excessos que aconteçam de ambos os lados"". ""Vamos (a SDH) adotar os procedimentos necessários para que esse tipo de evento não se reproduza."" Para Ideli, os protestos foram ""aquém das expectativas"", já que, somando-se todos os atos, ""o número de manifestantes não ultrapassou 4 mil pessoas, face aos milhões de brasileiros e turistas que participaram do evento esportivo, com caráter de confraternização entre os povos"". Ela também citou a ação policial na Radial Leste, via de acesso à Arena Corinthians, em São Paulo, onde houve confrontos entre manifestantes e policiais e prisões. A ministra garantiu que ""o direito de manifestação é absolutamente preservado"", porém, ""não é permitido depredação de patrimônio ou impedir a movimentação de outras pessoas"". A ministra também comentou o processo de ""higienização social"" denunciado pelo Ministério Público do Rio (MP-RJ), de que, com a aproximação da Copa do Mundo, a Prefeitura estaria retirando moradores de rua de centro, Lapa, Copacabana e Maracanã, áreas de grande circulação de turistas. ""Eu não posso dizer que isso não esteja acontecendo, mas estamos mobilizados para impedir que ocorra."" Ela garantiu que existe um protocolo ""para impedir, evitar e combater"" ações compulsórias para retirada dos moradores de rua e ressaltou que há ""um viés de raça e classe social nos índices de violência"" no Brasil."
35,AE Noticiário,13 Junho 2014,Sininho é indiciada por atos violentos em protestos,,Tiago Rogero,PORTUGUESE; PORTUGUÊS,,GERAL,Rio,FASTNEWS,Boletim de notícias,224 palavras,"June 13, 2014",,,"A ativista Elisa Quadros, conhecida como Sininho, foi indiciada no processo da Polícia Civil do Rio que investiga ""pessoas por participação direta ou indireta em prática de atos violentos durante protestos"". Nesta sexta-feira, 13, ela voltou à Cidade da Polícia, na zona norte do Rio, onde ficou por duas horas, mas se negou a prestar depoimento. Elisa teve os pertences apreendidos - computador, celular, agenda de telefone e itens pessoais como certidões de nascimento e escolaridade - pela polícia em operação na quarta-feira. Ontem, a exemplo de quarta, Sininho entrou e saiu da delegacia sem falar com a imprensa. ""Ela não prestou depoimento porque os policiais queriam que isso fosse feito sem que tivéssemos conhecimento do inquérito. Dizem que está sob segredo de Justiça, mas não pode ser escondido de quem tem de se defender"", disse o advogado da ativista, Marino D'Icarahy. Ele afirmou que vai ingressar na segunda-feira com um pedido de vista dos autos do processo. Na quarta-feira, um dia antes do início da Copa do Mundo, Sininho e outros nove ativistas de presença constante nas manifestações tiveram seus computadores e celulares apreendidos e foram levados à delegacia para depor. Eles ficaram durante todo o dia e foram liberados, mas os materiais continuam apreendidos. Sininho compareceu aos dois protestos do primeiro dia da Copa."
36,AE Noticiário,14 Junho 2014,Uso de balas de borracha por PM tem aval de cúpula,,"Rafael Italiani, Fabiana Cambricoli, Thaise Constancio",PORTUGUESE; PORTUGUÊS,,GERAL,São Paulo,FASTNEWS,Boletim de notícias,357 palavras,"June 14, 2014",,,"Tanto o secretário da Segurança Pública de São Paulo, Fernando Grella Vieira, quanto o comandante-geral da Polícia Militar, Benedito Roberto Meira, afirmaram nesta sexta-feira que o uso da munição e de outras armas não letais, como bombas de efeito moral, na zona leste de São Paulo, foi necessário para restabelecer a ordem e o direito de ir e vir da população e do torcedor. ""A polícia agiu corretamente. Usou força proporcional aos eventos e atos de violência para manter a ordem pública"", disse Grella. Há um ano, o secretário falou que a munição não seria usada em protestos. ""A bala de borracha não foi empregada (anteontem) contra manifestantes, foi usada em um grupo que estava ali para praticar atos de violência, agressão e ameaça"", afirmou. Grella disse ainda que a PM garantiu o direito de ir e vir e não se pode ""fazer julgamento"" a partir das imagens. A investigação foi instaurada ontem e será feita por meio de inquérito policial-militar (IPM). Por volta das 13h40 de quinta-feira, a PM lançou bombas contra um grupo que tentava fechar a Radial. Quem protagonizou os confrontos com a PM  - pelo menos seis entre 10h14 e 15h40 - foram cerca de 50 black blocs e anarquistas, muitos participantes dos protestos de junho de 2013. Entre os 15 feridos nos confrontos, há cinco repórteres: duas jornalistas da emissora americana CNN e um do SBT, atingidos por estilhaços de bomba; além de um jornalista argentino e um de TV francesa, por balas de borracha. Todos passam bem, mas a ação foi criticada por organizações de mídia, incluindo a Associação Brasileira de Emissoras de Rádio e Televisão (Abert), que considerou ""inaceitável que, a pretexto de conter protestos durante a Copa do Mundo, a polícia empregue métodos violentos contra jornalistas, impedindo-os de exercer sua função profissional"". Organizações internacionais também cobraram punições de quem se excedeu. ""As autoridades brasileiras prometem que a inauguração do Mundial será uma celebração, enquanto a polícia reprime brutalmente manifestantes pacíficos em São Paulo"", afirmou a Anistia Internacional, em nota oficial. As informações são do jornal  O Estado de S. Paulo."
