SEARCH_ROW,PUBLICATION,DATE,TITLE,EDITION,BYLINE,LANGUAGE,COUNTRY,SECTION,STATE,JOURNAL-CODE,PUBLICATION-TYPE,LENGTH,LOAD-DATE,DATELINE,SUBJECT,TEXT
114,Agence France Presse -- Portuguese,"June 10, 2014",Cinco soldados americanos mortos por 'fogo amigo' no Afeganistão,,,PORTUGUESE; PORTUGUÊS,United States,,,,Boletim de noticías,392 palavras,"June 10, 2014",WASHINGTON 10 Jun 2014,SUBJECT:,"Cinco soldados americanos mortos no Afeganistão foram provavelmente vítimas de ""fogo amigo"", anunciou nesta terça-feira o Pentágono, que assinalou que o incidente está sendo investigado. ""Cinco soldados americanos morreram ontem (segunda-feira) durante uma operação de segurança no sul do Afeganistão. Os investigadores consideram a possibilidade de que tenha sido por fogo amigo. Dedicamos nossos pensamentos e orações aos familiares dos mortos"", afirmou o contra-almirante John Kirby, porta-voz do departamento de Defesa. As autoridades afegãs afirmaram nesta terça-feira que os cinco soldados da Otan que morreram no sul do país foram vítimas de ""fogo amigo"", provocado por um engano em um ataque aéreo. O incidente de segunda-feira foi o mais grave para a Força Internacional da Otan (Isaf) desde que cinco soldados britânicos morreram em um acidente de helicóptero em 26 de abril. O incidente anterior com fogo amigo também aconteceu em abril, quando cinco soldados afegãos morreram em um bombardeio na província de Logar, leste do país, o que provocou muitos protestos do governo afegão. ""Posso confirmar que os cinco soldados estrangeiros morreram em um bombardeio de seu próprio exército no distrito de Arghandab"", disse à AFP o chefe de polícia da província de Zabul, Ghulam Sajhi Roghlewani. Até então, a nacionalidade das vítimas não havia sido confirmada. O porta-voz da divisão 205 do exército afegão, Mohsin Khan, também afirmou que o incidente foi um caso de ""fogo amigo"". Segundo ele, um soldado afegão morreu na ação. ""Nossas tropas estavam combatendo em conjunto contra os militantes quando os estrangeiros pediram apoio aéreo, que ao chegar bombardeou por engano posições amigas"", disse Khan. ""Posso confirmar que provocou baixas na Isaf. Nós também perdemos um soldado e outro ficou ferido"", completou. Um porta-voz da Isaf se negou a revelar detalhes sobre a acusação de engano. ""Estamos investigando o incidente"", disse. A Força Internacional divulgou um breve comunicado no qual afiram que ""cinco membros da Isaf morreram ontem (segunda-feira) no sul do Afeganistão"". As tropas da Otan lutam há mais de uma década contra a insurgência talibã no Afeganistão. Mas os 50.000 soldados que permanecem em território afegão devem deixar o país até o fim do ano. Caso um acordo seja assinado, apenas um pequeno contingente permanecerá até o fim de 2016."
115,Agence France Presse -- Portuguese,"June 10, 2014",Começa a libertação de prisioneiros anistiados na Síria,,,PORTUGUESE; PORTUGUÊS,Syrian Arab Republic,,,,Boletim de noticías,533 palavras,"June 10, 2014",DAMASCO 10 Jun 2014,SUBJECT:,"O regime sírio iniciou nesta terça-feira a libertação de dezenas de prisioneiros detidos, muitos deles sem julgamento, em diferentes cárceres do país, após a anistia decretada pelo presidente Bashar al-Assad. Assad decretou segunda-feira uma ""anistia geral"" para todos os crimes cometidos até dia 9 no país, na tentativa de se apresentar como o líder ""da reconciliação"", após sua polêmica reeleição à presidência. A anistia, a mais ampla das cinco decretadas por Damasco desde o início da revolta contra o regime, em março de 2011, acontece uma semana depois da vitória de Assad. ""Trata-de da mais importante anistia desde a chegada ao poder de Hafez al-Assad (pai de Bashar) há 45 anos"", afirmou o advogado Anwar al-Buni. Segundo o jurista, a anistia beneficiará tanto as pessoas que já foram julgadas como as que ainda se encontram presas pelos serviços de inteligência do regime. O texto cita pela primeira vez os crimes incluídos na lei sobre ""terrorismo"" de julho de 2012, que tem como alvo os rebeldes. O regime também inclui na anistia os combatentes estrangeiros, em sua maioria jihadistas, que se entregarem em até três meses. Mais de 100.000 pessoas detidas Segundo Bunni, ""dezenas de prisioneiros da prisão de Adra (perto da capital Damasco) foram libertados na segunda-feira, e o processo continua hoje. As organizações de defesa dos direitos humanos denunciaram, no entanto, que as anistias anteriores não foram totalmente aplicadas e muitos prisioneiros ainda estão atrás das grades. Mais de 100.000 pessoas estão detidas, incluindo 18.000 consideradas desaparecidas porque suas famílias não sabem o seu destino. De acordo com Bunni, o jornalista e defensor dos direitos humanos, Mazen Darwich, bem como seus colegas Hussein Ghreir e Hani Zaitani, detidos há dois anos na prisão de Adra, devem ser libertados. ""O tribunal anti-terrorismo e os tribunais criminais estão revisando os nomes dos prisioneiros que podem se beneficiar da anistia e enviarão suas listas para diferentes prisões"", como Adra e Saydnaya, ou a de Tadmor (Palmira), segundo o advogado. Contudo, ""os serviços de segurança têm as suas próprias listas"", indicou, Bunni. Segundo o advogado Michel Chammas, 50.000 pessoas estão nas prisões dos serviços de segurança. Em Homs (centro), o governador Talal Barazi afirmou à AFP que uma centena de prisioneiros no centro de Al-Andalus também foram anistiados. Esses presos, ex-rebeldes de Homs, que ""não cumpriram seu serviço militar estarão em casa em 72 horas"", disse ele. Assad, que viu seu poder vacilar em 2012 ante os rebeldes cuja influência se espalhou em torno de Damasco, Aleppo, no norte e no leste, sente confiança após uma série de vitórias no campo de batalha com o apoio da milícia xiita do Hezbollah, e com o apoio político e diplomático de Moscou e Teerã. Ele recebeu nesta terça-feira Hassan al-Nuri e Maher al-Hajjar, os outros dois candidatos à presidência. Assad, que sempre chamou os protestos pacíficos contra o seu gorverno de ""conspiração estrangeira"", declarou que ""o fluxo de pessoas às urnas mostrou muito claramente o compromisso do povo sírio em decidir seu destino sozinho, apesar de circunstâncias difíceis e excepcionais através da Síria "". rasim/ram/sk/vl/mr"
116,Agence France Presse -- Portuguese,"June 10, 2014",Bombardeio por engano da Otan mata 5 soldados americanos e um afegão,,,PORTUGUESE; PORTUGUÊS,Afghanistan,,,,Boletim de noticías,416 palavras,"June 10, 2014",CABUL 10 Jun 2014,SUBJECT:,"Cinco soldados americanos e um afegão morreram na segunda-feira no sul do Afeganistão, aparentemente por um bombardeio aéreo equivocado da Otan,, durante confrontos com rebeldes talibãs. Cinco soldados americanos mortos no Afeganistão foram provavelmente vítimas de ""fogo amigo"", anunciou nesta terça-feira o Pentágono, que assinalou que o incidente está sendo investigado. ""Cinco soldados americanos morreram ontem (segunda-feira) durante uma operação de segurança no sul do Afeganistão. Os investigadores consideram a possibilidade de que tenha sido por fogo amigo. Dedicamos nossos pensamentos e orações aos familiares dos mortos"", afirmou o contra-almirante John Kirby, porta-voz do departamento de Defesa. As autoridades afegãs afirmaram nesta terça-feira que os cinco soldados da Otan que morreram no sul do país foram vítimas de ""fogo amigo"", provocado por um engano em um ataque aéreo. O incidente de segunda-feira foi o mais grave para a Força Internacional da Otan (Isaf) desde que cinco soldados britânicos morreram em um acidente de helicóptero em 26 de abril. O incidente anterior com fogo amigo também aconteceu em abril, quando cinco soldados afegãos morreram em um bombardeio na província de Logar, leste do país, o que provocou muitos protestos do governo afegão. ""Posso confirmar que os cinco soldados estrangeiros morreram em um bombardeio de seu próprio exército no distrito de Arghandab"", disse à AFP o chefe de polícia da província de Zabul, Ghulam Sajhi Roghlewani. O porta-voz da divisão 205 do exército afegão, Mohsin Khan, também afirmou que o incidente foi um caso de ""fogo amigo"". Segundo ele, um soldado afegão morreu na ação. ""Nossas tropas estavam combatendo em conjunto contra os militantes quando os estrangeiros pediram apoio aéreo, que ao chegar bombardeou por engano posições amigas"", disse Khan. ""Posso confirmar que provocou baixas na Isaf. Nós também perdemos um soldado e outro ficou ferido"", completou. As tropas da Otan lutam há mais de uma década contra a insurgência talibã no Afeganistão. Mas os 50.000 soldados que permanecem em território afegão devem deixar o país até o fim do ano. Caso um acordo seja assinado, apenas um pequeno contingente permanecerá até o fim de 2016. As tentativas de negociações entre o governo afegão ou Estados Unidos - principal aliado e apoio financeiro do país - e os talibãs, expulsos do poder após a invasão do país por tropas internacionais lideradas por Washington e, 2001, não apresentaram resultados até o momento. str-emh/fp"
117,Agence France Presse -- Portuguese,"June 10, 2014",Estudantes chilenos voltam a protestar contra reforma educacional de Bachelet,,,PORTUGUESE; PORTUGUÊS,Chile,,,,Boletim de noticías,292 palavras,"June 10, 2014",SANTIAGO 10 Jun 2014,SUBJECT:,"Milhares de estudantes chilenos protestaram nesta terça-feira contra a reforma da educação proposta pelo governo de Bachelet, por acreditarem que ela não vai possibilitar uma educação pública de qualidade e gratuita. A manifestação, convocada pelas principais organizações estudantis do país, percorreu as ruas do centro da capital Santiago em um ambiente festivo, com a presença de professores. Participaram 80.000 pessoas, segundo a organização. A polícia não apresentou estimativas. Distúrbios isolados e confrontos com a polícia ocorreram ao fim da passeata. Foi o terceiro ato desde o início do novo governo de Bachelet, em março. O movimento estudantil mostrou novamente sua oposição aos primeiros projetos da reforma educacional, considerados ineficientes. Os estudantes também querem maior participação no processo. ""O governo apropriou-se de nossas palavras de ordem, mas não do conteúdo dessas palavras"", afirmou à AFP Luis Yañez, presidente do Sindicato Unitário dos Trabalhadores da Educação (SUTE), que reúne professores e auxiliares docentes. Yañez também criticou a mercantilização do ensino. Um primeiro conjunto de leis pretende acabar com o co-financiamento e com o lucro em escolas subsidiadas pelo governo, assim como a seleção dos alunos, que gera segregação social. Para os ativistas, no entanto, o projeto não cumpre seu objetivo de eliminar as lógicas de mercado na educação. ""Subsidiados, não vendidos!"" e ""Só com a força do movimento estudantil erradicaremos o mercado da educação"" indicavam cartazes exibidos no protesto. Desde 2011 os estudantes exigem em grandes manifestações uma educação pública de qualidade, em um país com um dos sistemas educacionais mais desiguais do mundo, herdado da ditadura de Augusto Pinochet (1973-1990)."
118,Agence France Presse -- Portuguese,"June 11, 2014",Taxistas europeus protestam contra veículos de turismo VTC,,,PORTUGUESE; PORTUGUÊS,Spain,,,,Boletim de noticías,537 palavras,"June 11, 2014",BARCELONA 11 Jun 2014,SUBJECT:,"Em Barcelona, Madri, Londres, Paris e outras cidades europeias, os taxistas protestaram nesta quarta-feira contra a concorrência dos chamados ""veículos de turismo com condutor"" (VTC), em particular da empresa americana Uber, que abalaram seu negócio. ""Nós vivemos do turismo quase o ano todo. E de repente chega esta gente que, sem pagar nenhum tipo de imposto nem ser profissional, tira seu negócio"", lamentava Silveri Pérez, taxista de 55 anos, na manifestação de Barcelona, única cidade espanhola onde a Uber opera, segundo seu site. Embora não tenha sido convocada oficialmente uma greve na cidade, a maioria dos motoristas deixaram seus carros em casa. Alguns grevistas danificaram os táxis de colegas que decidiram trabalhar e feriram um deles, informou a polícia. Em Madri, o setor organizou uma greve de 24 horas. ""Cerca de 100.000 famílias dependem diretamente do táxi"" em todo o país, lembraram seus organizadores. A administração na Espanha se posicionou a favor dos taxistas: o Ministério de Fomento lembrou que os VTC podem receber multas de 4.001 a 6.000 euros, enquanto em Barcelona o governo regional catalão exigiu fim imediato da atividade da Uber e iniciou o processo para impor punições. O movimento de protesto se originou no Reino Unido, onde os motoristas dos famosos táxis pretos estão preocupados com o espaço cada vez maior ocupado pela Uber, e seus colegas de outros países, também inquietos, os seguiram com uma mobilização em nível europeu. ""A Uber não respeita de forma deliberada as normas em vigor e também dispõe de meios muito importantes"", avaliados em 17 bilhões de dólares, resume Serge Metz, presidente da central francesa de rádio-táxi Taxi G7. A startup americana, fundada em 2009 em San Francisco, lançou um aplicativo para smartphones que coloca em contato particulares e motoristas não profissionais em 70 cidades de 36 países. A companhia cobra uma comissão sobre o preço da corrida. - Cumprir com as regras - Em Londres, milhares de taxistas se reuniram na Trafalgar Square e em seus arredores com seus característicos carros pretos, buzinando e exigindo a renúncia do prefeito conservador, Boris Johnson, a quem acusam de não proteger seus direitos. ""Não queremos proibir a Uber, mas se vierem, têm que cumprir as mesmas regras"", disse Steve McNamara, secretário-geral da Associação de Taxistas Registrados em Londres. Mas a diretora-geral da Uber, Jo Bertram, garantiu que a empresa superou ""a análise mais rígida e completa feita até a data pelo Transportes de Londres a um operador de veículos privados"". Os taxistas desta cidade convivem há décadas com os ""mini-táxis"" particulares nascidos na década de 1960 e regularizados em 1998. ""Não temos problema algum com a concorrência. Estamos há anos competindo com os mini-táxis"", mas ""não acreditamos que as pessoas que usam estes aplicativos estejam submetidas às mesmas regulações"", afirmou Ian Beetlestone, do sindicato RMT. Para evidenciar esta falta de regulação, em Roma foi organizada uma ""greve ao contrário"", com os taxistas trabalhando o dia inteiro sem regras e cobrando no máximo 10 euros a corrida, como denunciam que os VTC fazem. O movimento também afetava outras cidades da Itália, além de Alemanha e França. bur-dbh/acc/meb/ma/dm"
119,Agence France Presse -- Portuguese,"June 12, 2014",É oficial: a Igreja do Monstro de Espaguete Voador não é uma religião,,,PORTUGUESE; PORTUGUÊS,Austria,,,,Boletim de noticías,148 palavras,"June 12, 2014",VIENA 12 Jun 2014,SUBJECT:,"O Estado austríaco acaba de entregar seu veredicto: a Igreja do Monstro de Espaguete Voador, um culto satírico, não terá o status de religião na pequena república alpina. Solicitada pelo ""Macaroni Supremo"" do grupo, Philip Sager, o Escritório dos Cultos constatou que essa crença não está vinculada a nenhuma religião identificável. A imprensa austríaca ressalta que esta decisão é um revés para o ""pastafariano"" Niko Alm, um deputado liberal que, em 2011,:obteve o direito de usar na fotografia de sua carteira de motorista um escorredor de macarrão na cabeça. O pastafarianismo foi fundado por Bobby Henderson em 2005 em protesto contra a decisão de alguns estados americanos de implementar o ensino do criacionismo como alternativa ao evolucionismo biológico. A Igreja do Monstro de Espaguete Voador solicita há meses um reconhecimento oficial, reivindicando ter 450 ""fiéis"". cs/fw/meb/jz/mr"
120,Agence France Presse -- Portuguese,"June 12, 2014",Anistia Internacional dá cartão amarelo para polícia brasileira,,,PORTUGUESE; PORTUGUÊS,United Kingdom,,,,Boletim de noticías,125 palavras,"June 12, 2014",LONDRES 12 Jun 2014,SUBJECT:,"A organização de defesa dos direitos humanos Anistia Internacional divulgou um protesto contra a repressão policial de uma manifestação nesta quinta-feira em São Paulo, a poucas horas da inauguração da Copa do Mundo. ""As autoridades brasileiras prometem que a inauguração do Mundial será uma celebração, enquanto a polícia reprime brutalmente manifestantes pacíficos em São Paulo, ferindo pelo menos dois jornalistas"", criticou a ONG em comunicado. ""Damos cartão amarelo para a Polícia Militar de São Paulo"", explicou o diretor da organização no Brasil, Átila Roque. ""As autoridades brasileiras têm de investigar, sem demora, porque se usou uma força excessiva contra manifestantes pacíficos e levar os responsáveis à Justiça"", acrescentou Roque. al/gr/tt-mm"
121,Agence France Presse -- Portuguese,"June 13, 2014",Inflação oficial na Venezuela supera 60%,,,PORTUGUESE; PORTUGUÊS,Venezuela,,,,Boletim de noticías,163 palavras,"June 15, 2014",CARACAS 13 Jun 2014,SUBJECT:,"A inflação na Venezuela em 12 meses atingiu 60,9% em maio passado, após uma alta mensal de 5,7% provocada por ""eventos de conflito político"", informou o Banco Central nesta quinta-feira. ""A inflação anual correspondente ao mês de maio foi de 60,9%, abaixo dos 61,5% observados no mês  precedente"", revelou o BC em seu site, acrescentando que a variação do índice de preços ao consumidor em maio foi de 5,7%. ""Perturbações de caráter extraordinário, alheias a fatores próprios da atividade produtiva, influíram desfavoravelmente nos resultados do INPC (...) com o consequente efeito nos resultados da inflação"", destaca o BC. As principais altas foram registradas entre alimentos e bebidas não alcoólicas, com 6,4%, restaurantes e hotéis, 6,9%, e transportes, 10,1%. A Venezuela enfrenta uma onda de protestos desde fevereiro devido à inflação, à falta de produtos básicos - como papel higiênico, açúcar, farinha ou leite - e à violência que provoca em média 65 mortes por dia no país."
122,Agence France Presse -- Portuguese,"June 13, 2014",Junta militar da Tailândia retira toque de recolher,,,PORTUGUESE; PORTUGUÊS,Thailand,,,,Boletim de noticías,174 palavras,"June 15, 2014",BANGCOC 13 Jun 2014,SUBJECT:,"A junta militar tailandesa anunciou nesta sexta-feira o fim do toque de recolher em todo o país, três semanas após protagonizar um golpe de Estado. O toque de recolher entre meia-noite e 4h00 já havia sido retirado em várias províncias e nas principais cidades turísticas e ilhas do país. Desde o golpe de 22 de maio, a junta militar limitou as liberdades civis, proibiu manifestações, prendeu centenas de opositores, políticos, jornalistas e universitários e estabeleceu a censura à imprensa. A junta militar - que anunciou na quinta-feira que graças a ela os tailandeses poderiam assistir aos jogos da Copa do Mundo gratuitamente pela televisão - argumenta que tomou o poder para restaurar a ordem pública, depois de sete meses de protestos que levaram à destituição da primeira-ministra Yingluck Shinawatra, irmã de Thaksin Shinawatra, que foi deposto por outro golpe em 2006. Os opositores afirmam que o objetivo do golpe é limitar a influência da família Shinawatra, muito popular entre as massas do norte e nordeste do país. ask-abd/jeb/jz/me/jo/mr"
123,Agence France Presse -- Portuguese,"June 13, 2014",Vídeo mostra indiferença dos indianos quanto à violência contra mulheres,,,PORTUGUESE; PORTUGUÊS,India,,,,Boletim de noticías,308 palavras,"June 15, 2014",NOVA DELHI 13 Jun 2014,SUBJECT:,"Uma experiência sociológica gravada em vídeo em Nova Délhi demonstra a indiferença de indianos que ignoram completamente os gritos de uma mulher trancada dentro de um veículo, num momento em que a Índia é cenário de uma série de assassinatos e estupros. Os autores da experiência, membros do grupo ""YesNoMaybe"", asseguram que o vídeo, postado no YouTube, demonstra a apatia reinante na Índia em relação às violências contra as mulheres, apesar da indignação pontual gerada pelo estupro coletivo e pelo assassinato de duas adolescentes no final de maio passado. ""Ainda persiste um desinteresse total sobre o que acontece com as mulheres, uma insensibilidade, apesar dessa atitude começar a mudar"", afirma a militante feminista Ranjana Kumari. No vídeo, que já foi visto mais de 1,2 milhão de vezes desde a semana passada, é possível ver um furgão branco estacionado à noite em um bairro remoto de Nova Délhi, com as janelas com película escura. Embora os gritos da mulher dentro do veículo sejam ouvidos nitidamente, os homens que passam por perto não se interessam ou apenas param para ouvir um pouco antes de seguir em frente. Por fim, um rapaz tenta abrir a porta do carro, consciente de que deve estar ocorrendo um estupro. Um homem mais velho usa um pedaço de pau para tentar quebrar as janelas. O vídeo gerou uma onda de protestos nas redes sociais, tanto dos que se sentiram ofendidos pela obra, como das pessoas defenderam a experiência como uma forma de refletir sobre a condição das indianas ou das mulheres em geral. O sociólogo Shiv Visvanathan destacou, por sua parte, que é difícil tirar conclusões da experiência porque provavelmente muitos dos transeuntes não fizeram nada por temer sofrer algum tipo de agressão. O vídeo pode ser visto no endereço <www.youtube.com/watch?v=9Dms1FCc4hc&list=TLAvL6b2LM3KStf61eIUjtnYf5O39ECfmv> tha/co/lm/me.zm/cn"
124,Agence France Presse -- Portuguese,"June 13, 2014",Ban Ki-moon recebe torta com farinha de coca em festa de aniversário na Bolívia,,,PORTUGUESE; PORTUGUÊS,Bolivia,,,,Boletim de noticías,299 palavras,"June 15, 2014","SANTA CRUZ, Bolívia 13 Jun 2014",SUBJECT:,"Uma comunidade do leste da Bolívia preparou uma torta com farinha de coca para desejar feliz aniversário ao secretário-geral das Nações Unidas, Ban Ki-moon, que completou 70 anos nesta sexta-feira e está no país para a cúpula do G77+China no fim de semana. Em uma festa colorida, com danças típicas, Ban soprou as 70 velas do bolo, decorado também com folhas de coca. Um grupo de crianças cantou parabéns em inglês, espanhol e ayoreo - língua local - para o secretário-geral, que ficou emocionado e recebeu diversos presentes. ""Obrigado por esta comemoração. Obrigado pelos presentes, vou levá-los para a Nova York para sempre me lembrar de vocês"", agradeceu ele. A festa aconteceu em um teatro no povoado de El Torno, a 30 km de Santa Cruz. A coca, em seu estado natural, é usada pelos bolivianos para fins medicinais e em rituais, e também para elaborar vários produtos, como licores ou alimentos. A prática de mastigar folhas de coca, ancestral na Bolívia, foi reconhecida pela ONU em sua Convenção sobre Drogas em 2013, depois de um protesto por parte do país. Existem muitas plantações ilegais do produto, destinadas ao narcotráfico, na Bolívia, que é o terceiro maior produtor mundial de folhas de coca e de cocaína, atrás de Peru e Colômbia. Ban inaugura no sábado em Santa Cruz a cúpula do G77+China, onde 133 países em desenvolvimento vão traçar com o gigante asiático uma agenda posterior aos Objetivos do Milênio, metas estabelecidas pelas Nações Unidas em 2000. O encontro, que vai até domingo, também celebra os 50 anos do bloco, que foi criado com 77 membros em 1964 e hoje reúne 133 nações. Diversos presidentes e chefes de governo são esperados para a cúpula, entre eles Cristina Kirchner (Argentina), Rafael Correa (Equador), Hassan Rohani (Irã) e José Mujica (Uruguai). jac-rb/jco/ll/dg/dm"
