SEARCH_ROW,PUBLICATION,DATE,TITLE,EDITION,BYLINE,LANGUAGE,COUNTRY,SECTION,STATE,JOURNAL-CODE,PUBLICATION-TYPE,LENGTH,LOAD-DATE,DATELINE,SUBJECT,TEXT
1,O Globo (Brazil),"June 13, 2014",Confrontos têm 17 feridos e 70 detidos,,Felipe Werneck e Tiago Rogero,PORTUGUESE; PORTUGUÊS,,POLÍTICA,Rio de Janeiro,FASTNEWS,Boletim de notícias,533 palavras,"June 12, 2014",,,"Capitais registraram episódios de quebra-quebra e de embates com a polícia em protestos contra mundial Tiago Dantas, Sérgio Roxo, Demétrio Weber, Flávio Ilha e Thays Lavor opais@oglobo.com.br Batalha. Em São Paulo, mascarado joga bomba de gás na polícia durante protesto contra a Copa: seis horas de tumulto Pelo menos 17 pessoas ficaram feridas e mais de 70 foram detidas durante protestos em várias capitais ontem. Apenas em Belém a manifestação transcorreu pacificamente. Nas demais capitais, houve quebra-quebra, confrontos com a polícia, vândalos mascarados e muita confusão. Entre os feridos há cinco jornalistas estrangeiros, sendo que quatro foram atingidos em São Paulo e um em Belo Horizonte. São Paulo, cidade da abertura da Copa, registrou seis horas de protestos antes do jogo entre Brasil e Croácia. Pelo menos 12 pessoas ficaram feridas. No total, 43 pessoas foram detidas por agressão, desacato ou até posse de material explosivo. A Polícia Militar usou a força para evitar que a Radial Leste, principal ligação entre o centro da cidade e o Itaquerão, fosse bloqueada. A Anistia Internacional acusou a PM de usar força desproporcional contra os manifestantes, o que foi negado pela corporação. Os protestos se concentraram na região do Tatuapé, a cerca de dez quilômetros do estádio. A estação de metrô do bairro ficou fechada por mais de uma hora e foi palco de confrontos. Passageiros, entre eles alguns turistas estrangeiros, ficaram no meio do tumulto. A PM usou bombas de gás lacrimogêneo, de efeito de borracha e balas de borracha. Por outro lado, manifestantes chegaram a depredar o carro de uma emissora de TV. Diferentemente de outros protestos contra a Copa que ocorreram este ano, a polícia se antecipou à ação dos manifestantes, tentando dispersá-los logo que se agrupavam. A concentração do chamado Grande Ato contra a Copa estava prevista para a estação Carrão do Metrô, também na Zona Leste, às 10h. Doze minutos depois, a PM já usava bombas de gás e cassetetes para tirar da rua os cerca de 200 jovens que começavam a chegar ao ponto de encontro. Em um desses confrontos as jornalistas da rede americana CNN ficaram feridas com estilhaços de bomba atiradas pela PM. Depois de tentarem se reagrupar e verem mais dois avanços policiais, os manifestantes caminharam até a sede do Sindicato dos Metroviários, no Tatuapé, onde um grupo de cerca de 500 sindicalistas fazia um ato contra a demissão de 42 funcionários do Metrô após a greve de cinco dias da categoria. Lá, houve mais confrontos depois que um grupo de jovens com rostos cobertos montou barricadas com lixeiras, madeira e fogo, ao lado de um posto de gasolina. Os metroviários decidiram entrar no prédio do sindicato e abandonar o protesto. Eles combinaram com a polícia que sairiam do edifício de forma pacífica, afirmando que não concordavam com a violência do outro grupo. Foram chamados de pelegos pelos manifestantes mais radicais. Sem os metroviários na rua, os policiais militares expulsaram quem ainda participava do ato. Novos focos de brigas ocorreram nas ruas do Tatuapé. Manifestantes entraram na estação de metrô, sempre seguidos por policiais. Os dois shoppings anexos à estação fecharam as portas, comerciantes se esconderam e passageiros correram assustados. Outro grupo, formado por não mais que 50 pessoas, conseguiu fechar a Radial Leste por alguns minutos, entre o viaduto Pires do Rio e estação Belém do Metrô. Eles caminhavam na contramão da pista sentido zona leste da avenida e usaram barreiras de plástico da CET para impedir o tráfego. Novamente, a Tropa de Choque reagiu e liberou o trânsito arremessando bombas de efeito moral no meio de carros que estavam parados na pista e disparando balas de borracha contra os manifestantes. Policiais e manifestantes protagonizaram uma série de brigas e provocações ao longo de mais de duas horas dentro da passarela que dá acesso às bilheterias e às áreas de embarque e desembarque da estação Tatuapé. O conflito terminou com o terminal sendo fechado e evacuado pela PM, com o uso de mais bombas de gás lacrimogêneo. Passageiros que nem sabiam o que estava acontecendo tiveram que sair correndo. Alguns esperaram 45 minutos até que a estação fosse aberta. Na Zona Oeste da cidade, a PM deteve 29 estudantes dentro do campus da Universidade Estadual Paulista (Unesp) porque eles estariam portando canivetes, vinagre e máscaras. O grupo foi levado para a delegacia, e até a noite não sabia se seria liberado. Em Belo Horizonte um grupo interditou o trânsito na Praça Sete, no Centro, queimou a bandeira do Brasil em cima do obelisco e, minutos antes da seleção entrar em campo, black blocs tombaram um carro da PM e houve confronto. O fotógrafo Sérgio Moraes, da Agência Reuters, foi atingido na cabeça e sofreu traumatismo craniano. Em Brasília, o protesto contra a Copa levou cerca de cem manifestantes às proximidades do Taguaparque, local da Fan Fest da Fifa, na periferia de Brasília e duas pessoas foram detidas durante uma confusão com a PM. Em Fortaleza, um grupo de 200 pessoas protestou contra as violações de direitos humanos e os gastos públicos da Copa. O ato começou pacífico, mas ao chegarem em frente a Arena Fan Fest, por volta das 18h, cerca de 60 manifestantes com os rostos cobertos atearam fogo em lixeiras e jogaram pedras e bombas caseiras em direção ao local. A polícia interveio, e duas pessoas foram presas. Copyright Grupo de Diarios Amyeacute;rica-GDA/O Globo/Brasil. Todos los derechos reservados. Prohibido su uso o reproducciyoacute;n en Brasil © NoticiasFinancieras - © GDA- Agencia Globo - All rights reserved Três ficaram feridos em protestos no Rio  Cerca de dois mil manifestantes fizeram dois protestos nesta quinta-feira, no Rio, contra a Fifa, a Copa do Mundo e os gastos públicos empregados na realização do Mundial. As manifestações foram pacíficas, mas, após o fim do ato da manhã, houve confronto entre PMs e ativistas. Três pessoas foram detidas durante a manifestação. No protesto da tarde, pelo menos mais quatro pessoas foram detidas e três ficaram feridas. Mais de mil pessoas participaram do protesto no Centro, pela manhã, e outras 800 em Copacabana, à tarde, próximo à Fan Fest da Fifa. O de mais cedo foi marcado pela manhã justamente porque os participantes não escondiam a vontade de ver a estreia do Brasil. ""Não é contra a Copa que estamos protestando, mas contra a forma como as coisas aconteceram. Queremos mais verbas para as questões sociais, como educação"", disse o historiador Arthur Gibson, do Conlutas. O deputado federal Chico Alencar (Psol-RJ) também participou do protesto e confirmou que pretendia assistir ao jogo e, por isso, não participaria da manifestação marcada para mais tarde. Ele chegou a conversar com PMs para pedir que não houvesse repressão ao protesto, que correu pacificamente. Um grupo de manifestantes, em especial, chamava a atenção: os integrantes da ""Carnavandalirização"" usavam fantasias, jogavam purpurina uns no outros, seguravam balões e protestavam, tudo num clima carnavalesco. Nos Arcos da Lapa, quando grande parte dos manifestantes já havia ido embora, houve início de confusão entre PMs e um grupo de ativistas. Um deles foi agarrado pelo pescoço e detido. Depois, uma ativista jogou uma latinha de cerveja nos PMs e também foi detida. Noutro ponto, mais um manifestante foi preso. O grupo então se manifestou e muitos partiram para Copacabana e o protesto da tarde. Logo na concentração do segundo ato, um manifestante foi preso acusado de xingar um PM. Concentrados desde as 15h30 em frente à estação de metrô Cardeal Arcoverde, em Copacabana, o grupo chegou à av. Atlântica (orla, local da festa da Fifa) 10 minutos antes do início do jogo. Faixas contra a Fifa dominavam o ato: ""Fifa go home!"" era a principal delas. No instante do gol da Croácia, o grupo - majoritariamente de preto - comemorou e correu na direção de torcedores com camisetas amarelas, abrindo um buraco na multidão. Um torcedor de camisa azul da seleção agrediu um manifestante e foi contido por outros dois torcedores. No início da noite, quando a maioria dos manifestantes já tinha ido embora, um pequeno grupo fez um protesto embaixo do Centro Aberto de Mídia, nas imediações do Forte de Copacabana. Policiais do Batalhão de Choque tentaram dispersar o grupo e houve um princípio de confusão e detenções. Um homem que segurava um coco foi perseguido na areia, espancado e preso por policiais. No tumulto, um manifestante ficou ferido na cabeça e um PM foi atingido também na cabeça por uma garrafa. Em seguida, outro manifestante foi detido na avenida Atlântica depois de chutar uma lata de lixo que já havia sido revirada na chão. No bar Sindicato do Chope, situado na avenida Atlântica, uma mulher que bebia em uma mesa no calçadão  agrediu uma manifestante anti-Copa e foi levada para a delegacia após o tumulto."
3,O Globo (Brazil),"June 10, 2014",Governo cede à pressão dos sem-teto em sp,,OGlobo,PORTUGUESE; PORTUGUÊS,TUR,,,,Boletim de noticías,545 palavras,"June 12, 2014",ISTAMBUL 12 Jun 2014,SUBJECT:,"Depois da promessa de construção de moradias, mtst anuncia a suspensão de protestos durante mundial Julianna Granjeia julianna.granjeia@sp.oglobo.com.br Luiza Damé luiza@bsb.oglobo.com.br Transtorno. Protesto que reuniu, em maio, 15 mil integrantes do Movimento dos Trabalhadores Sem-Teto (MTST) no entorno do Itaquerão, pressionou governo por mudanças no Minha Casa Minha Vida Fernando Donasci Às vésperas da abertura da Copa do Mundo, o governo federal fez um acordo, ontem, com o Movimento dos Trabalhadores Sem Teto (MTST), e vai construir moradias no terreno próximo ao Itaquerão, conhecido como Copa do Povo. De acordo com a Secretaria Geral da Presidência, que participou da negociação, o governo vai mudar as regras do programa Minha Casa Minha Vida para atender às pessoas que vivem em ""situação de coabitação"" e têm ""ônus excessivo do aluguel"". No fim de maio, o MTST fez um protesto na região do Itaquerão, onde ocorrerá o jogo de abertura da Copa do Mundo, Brasil x Croácia, e provocou um longo congestionamento. A presidente Dilma Rousseff e mandatários estrangeiros vão participar da abertura na Arena Corinthians. As mudanças serão incluídas na terceira etapa do Minha Casa Minha Vida, que será lançada por Dilma ainda este mês. A presidente havia prometido anunciar a nova fase do programa no último dia 29 de maio, mas a data foi adiada por falta de acordo dentro do governo federal. As moradias populares destinadas à população de baixa renda serão construídas em Itaquera, numa parceria do governo federal com o governo do estado e a prefeitura de São Paulo. Segundo nota da Secretaria Geral da Presidência, na próxima etapa do Minha Casa Minha Vida, o governo federal irá ampliar o limite do Minha Casa Minha Vida Entidades. Atualmente, o teto é de mil unidades habitacionais por entidade. ""A partir da nova etapa, estando a entidade habilitada, com as devidas prestações de contas e a comprovação de bom desempenho, ela poderá receber novo lote de mil unidades, ampliável até o total de 4 mil unidades"", diz a nota. Ainda segundo a nota, o governo irá organizar as áreas de ""acompanhamento de conflitos urbanos, com foco na mediação"" do Ministério das Cidades, da Secretaria de Direitos Humanos, do Ministério da Justiça e da Secretaria Geral. ""Esta atuação será preventiva e nos casos em que se possa, nos termos da lei, propor alternativas que estimulem o entendimento e a resolução pacífica de conflitos"", diz a nota. Ontem à tarde, o MTST anunciou o fim dos protestos programados em São Paulo contra a Copa. Pela manhã, contudo, o movimento realizou, no Centro de São Paulo, um manifesto em apoio aos metroviários em greve na cidade. - As mobilizações serão menos intensas porque nossas reivindicações foram acolhidas. Mas o MTST estará na Câmara ( De São Paulo ) pressionando os vereadores pela aprovação do plano diretor - anunciou o coordenador nacional do MTST, Guilherme Boulos. Boulos iniciou sua entrevista coletiva negando que o movimento já tinha feito um acordo com o governo e dizendo que as manifestações voltariam durante o Congresso da Fifa e no dia da abertura da Copa do Mundo. No entanto, um telefonema interrompeu a coletiva. Ao voltar, Boulos anunciou que a pauta do movimento tinha sido atendida. - As atenções se voltarão para a Câmara. O MTST não é contra a Copa. É contra os efeitos perversos que ela tem na periferia e por não deixar um legado ao país - disse. Segundo Boulos, a construtora Viver, dona do terreno onde está a ocupação (batizado de Copa do Povo), será responsável pela construção das cerca de 2 mil unidades habitacionais para atender as famílias acampadas na área. O projeto será feito em parceria com o movimento. O governo federal, por meio do Minha Casa Minha Vida, entrará com aporte de R$ 76 mil por unidade. Um complemento financeiro caberá à prefeitura e ao governo estadual. No próximo dia 16, haverá uma audiência judicial para formalizar o acordo e para não haver risco de reintegração de posse. O governo federal também se comprometeu a alterar a portaria 595, que regulamenta o programa Minha Casa Minha Vida, que extinguirá a necessidade de que 75% das unidades do programa sejam destinadas a áreas de risco. Além disso, o governo ficou de discutir um aumento do limite de renda da faixa 1 do programa. Recentemente, o MTST participou de outros protestos relativos ao Mundial. No fim de maio, em Brasília, houve transtornos que levaram à suspensão da apresentação oficial da Taça Fifa, que estava sendo exibida no estacionamento do Estádio Mané Garrincha. Um protesto de 2.500 pessoas, segundo cálculo da Polícia Militar, parou a capital federal no dia 27. Os manifestantes - além dos sem-teto, índios e integrantes de organizações sociais como o Comitê Popular da Copa - entraram em confronto com a polícia. Com o tumulto, a exibição da taça, que iria até as 21h, foi suspensa no fim da tarde. Das dez mil pessoas que a veriam, só dois terços conseguiram. Na véspera, cerca de 70 professores em greve haviam cercado o ônibus da seleção brasileira, no Rio, deram tapas na lataria e colaram adesivos contra o Mundial. Copyright Grupo de Diarios Amyeacute;rica-GDA/O Globo/Brasil. Todos los derechos reservados. Prohibido su uso o reproducciyoacute;n en Brasil © NoticiasFinancieras - © GDA- Agencia Globo - All rights reserved Começa na Turquia julgamento de líderes de protestos antigovernamentais de 2013  O julgamento dos 26 supostos líderes dos protestos que há um ano abalaram o governo turco começou nesta quinta-feira em um tribunal de Istambul, um processo que a oposição classifica de vergonha e escândalo. Duas semanas depois dos confrontos por ocasião do primeiro aniversário desta revolta, os membros do grupo Taksim Solidariedade, entre eles arquitetos, engenheiros e médicos, são acusados de ter organizado e participado de manifestações que se estenderam por grande parte do país no ano passado. O crime de participação em uma organização criminosa é punido com penas de até 30 anos de prisão. Antes de entrar na sala, quase cem membros do grupo Taksim Solidariedade, que reúne ONGs, sindicatos e representantes da sociedade civil, se reuniram diante do Palácio de Justiça para fazer uma declaração à imprensa. ""Este julgamento é uma mancha na história do país. É o julgamento da vergonha e do constrangimento, quase um escândalo. Hoje estão sendo julgadas a liberdade, a democracia e a paz"", leu uma porta-voz da associação de médicos turca. ""Recep Tayyip Erdogan (o primeiro-ministro turco), que segue reprimindo manifestantes, é quem deveria estar no banco dos réus por atentar contra a democracia e o Estado de direito"", declarou a porta-voz antes de entrar no tribunal. O movimento de protesto - sem precedentes desde a chegada ao poder do governo islamita conservador de Erdogan em 2002 - começou no fim de maio de 2013, com a mobilização de ecologistas contrários à destruição do famoso parque Gezi. Após a violenta intervenção das forças de segurança no dia 31 de maio, o movimento se transformou em uma onda de protestos contra o governo de Erdogan, considerado autoritário. Durante três semanas, mais de 3,5 milhões de turcos protestaram em uma centena de cidades sob forte repressão policial. As manifestações terminaram com oito mortos, mais de 8.000 feridos e milhares de detenções. Depois o executivo retomou com firmeza o controle da situação, e reprime agora qualquer tentativa de protestos. - Repressão e detenções - No dia 31 de maio Erdogan mobilizou mais de 20.000 policiais que dissolveram brutalmente as manifestações, todas proibidas, que lembravam o primeiro aniversário das revoltas de Gezi. Mais de 300 pessoas foram detidas. Na terça-feira, o primeiro-ministro, prestes a anunciar sua candidatura para as eleições presidenciais de agosto, acusou a ""gente de Gezi"" de ser agentes de um complô contra seu regime. ""Não queriam defender as árvores nem o meio ambiente, mas semear o caos"", afirmou. Neste contexto político extremamente tenso, os acusados da Taksim Solidariedade esperam um julgamento político. Por sua vez, o governo turco ordenou na quarta-feira a transferência de mais de 2.000 magistrados no âmbito da luta contra seus antigos aliados do movimento do imã Fethullah Gullen e também realizou mudanças no Estado-Maior e no banco central. Trata-se da reorganização mais importante na magistratura desde a revelação em meados de dezembro de um escândalo de corrupção que afeta todo o governo de Erdogan. O primeiro-ministro acusa o movimento do pregador muçulmano Fethullah Gullen, que foi seu aliado na conquista do poder, de ser o responsável pelas acusações de corrupção e de ter produzido um complô para provocar sua queda. dg-pa/jh/me/pc/ma"
5,Agence France Presse -- Portuguese,"June 12, 2014",Polícia dispersa com gás lacrimogêneo protesto contra Copa em SP,,,PORTUGUESE; PORTUGUÊS,Brazil,,,,Boletim de noticías,456 palavras,"June 12, 2014",SåO PAULO 12 Jun 2014,SUBJECT:,"A polícia lançou bombas de gás lacrimogêneo, balas e borracha e bombas de efeito moral para dispersar manifestantes contrários à Copa em São Paulo, onde nesta quinta-feira ocorre a abertura do Mundial de futebol com a estreia do Brasil contra a Croácia, constatou um jornalista da AFP. Duzentos manifestantes se reuniram na manhã desta quinta-feira perto da estação de metrô Carrão da cidade, carregando um cartaz que dizia ""Se não temos direitos, não vai ter Copa"". Disseram que seu objetivo era se aproximar o máximo possível da Arena Corinthians, estádio onde irá ocorrer a abertura do Mundial às 17h00, mas a polícia de choque, carregando escudos, os dispersou com bombas de efeito moral e de gás lacrimogêneo antes que a passeata avançasse. Um policial disparou balas de borracha contra um manifestante sem camisa que se postou no meio da rua e se recusava a sair. Posteriormente a polícia o deteve. Uma jornalista da rede de televisão americana CNN foi ferida enquanto cobria o protesto ao sofrer o impacto de uma bomba de gás lançada pela polícia. A informação foi confirmada por outra jornalista da CNN em São Paulo, que agradeceu em sua conta do Twitter a colegas e manifestantes pela ajuda prestada à produtora Barbara Arvanitidis, ferida enquanto uma equipe deste canal americano cobria ao vivo o protesto. Arvanitidis recebeu ajuda de socorristas e tinha o braço enfaixado, além de sangue em sua camisa, indicou um jornalista da AFP presente na manifestação. Após os confrontos com a polícia, os manifestantes voltaram a se concentrar em uma rua vizinha, e lançaram garrafas de cerveja e pedras contra a polícia, que respondeu com mais de uma dezena de bombas de gás lacrimogêneo e de efeito moral. Os manifestantes também coletaram lixo e montaram barricadas em chamas na rua. ""Não vai ter Copa!"", gritavam os manifestantes antes de ser dispersados, uma frase que se converteu no lema de muitos brasileiros indignados com os 11 bilhões de dólares que o Mundial custará aos contribuintes brasileiros, e que poderia ser usado para setores como educação, saúde, habitação e transporte. Gregory Leão, um estudante de 27 anos que participou do protesto, disse que os manifestantes queriam se aproximar do estádio. ""O objetivo é colocar fim à Copa do Mundo. Percebemos que não conseguiremos isso, mas acreditamos que os brasileiros devem participar de uma revolta"", disse à AFP. ""Os brasileiros amam o futebol, mas não precisam disso agora"", acrescentou. Para o país, de 200 milhões de habitantes, a Copa tem um sabor agridoce. Muitos brasileiros saíram às ruas vestidos de verde, azul e amarelo, as cores da bandeira, incluindo a presidente Dilma Rousseff. Mas outros têm medo dos protestos ou pretendem participar das manifestações. lth-lbc/ma"
6,AE Noticiário,12 Junho 2014,Quatro são detidos em dois protestos no Rio,,Felipe Werneck e Tiago Rogero,PORTUGUESE; PORTUGUÊS,,GERAL,Rio,FASTNEWS,Boletim de notícias,469 palavras,"June 12, 2014",,,"Cerca de 2 mil manifestantes fizeram dois protestos nesta quinta-feira, no Rio, contra a Fifa, a Copa do Mundo e os gastos públicos empregados na realização do Mundial. As manifestações foram pacíficas, mas, após o fim do ato da manhã, houve confronto entre PMs e ativistas. Pelo menos três pessoas foram detidas na manifestação e, no protesto da tarde, mais um ativista foi detido e outro agredido por um torcedor. Mais de mil pessoas participaram do protesto no centro, pela manhã, e outras 800 foram até Copacabana, à tarde, próximo da Fan Fest da Fifa. O de mais cedo foi marcado pela manhã justamente porque os participantes não escondiam a vontade de ver a estreia do Brasil. ""Não é contra a Copa que estamos protestando, mas contra a forma como as coisas aconteceram. Queremos mais verbas para as questões sociais, como para a área da educação"", disse o historiador Arthur Gibson, do Conlutas. O deputado federal Chico Alencar (Psol-RJ) também participou do protesto e confirmou que pretendia assistir ao jogo e, por isso, não participaria da manifestação marcada para mais tarde. ""Eu gosto de futebol e vou assistir à estreia do Brasil mais tarde. Temos de saber conciliar o que é uma tradição cultural nossa, o futebol, com a visão crítica do quanto custou. Não tenho dúvidas de que realizar a Copa foi uma grande furada para o Brasil."" Ele chegou a conversar com PMs para pedir que não houvesse repressão ao protesto, que correu pacificamente. Um grupo de manifestantes, em especial, chamava a atenção: os integrantes da ""Carnavandalirização"" usavam fantasias, jogavam purpurina uns nos outros, seguravam balões e protestavam, tudo em um clima carnavalesco. Nos Arcos da Lapa, quando grande parte dos manifestantes já havia ido embora, houve um início de confusão entre policiais militares e um grupo de ativistas. Um deles foi agarrado pelo pescoço e detido. Depois, uma ativista jogou uma latinha de cerveja nos PMs e também foi detida. Em outro ponto, mais um manifestante foi preso. O grupo então se dispersou e muitos partiram para Copacabana. Logo na concentração do segundo ato, um manifestante foi preso acusado de xingar um PM. Concentrado desde as 15h30 na frente da Estação de Metrô Cardeal Arcoverde, em Copacabana, o grupo chegou à Avenida Atlântica (na orla, local da festa da Fifa) 10 minutos antes do início do jogo. Faixas contra a Fifa dominavam o ato: ""Fifa go home!"" era a principal delas. No instante do gol da Croácia, o grupo - majoritariamente de preto - comemorou e correu na direção de torcedores com camisetas amarelas, abrindo um buraco na multidão. Um torcedor de camisa azul da seleção agrediu um manifestante e foi contido por outros dois torcedores. Até as 19 horas, não houve tumulto entre PMs e manifestantes. Os militares acompanharam de longe e não interferiram no ato."
