SEARCH_ROW,PUBLICATION,DATE,TITLE,EDITION,BYLINE,LANGUAGE,COUNTRY,SECTION,STATE,JOURNAL-CODE,PUBLICATION-TYPE,LENGTH,LOAD-DATE,DATELINE,SUBJECT,TEXT
22,O Globo (Brazil),"July 13, 2014","No exterior, vale enfrenta protestos por riscos ambientais",,OGlobo,PORTUGUESE; PORTUGUÊS,ZZZ,,,,Boletim de noticías,932 palavras,"July 7, 2014",JERUSALEM 07 Jul 2014,SUBJECT:,"Na nova caledônia e no peru, eleições acirram oposição à mineradora Danielle Nogueira danielle.nogueira@oglobo.com.br Tensão. Unidade de níquel da Vale, na Nova Caledônia: multa de US$ 460 mil Divulgação Não bastasse os preços baixos do minério de ferro, a Vale tem se deparado com o ressurgimento da oposição a alguns projetos no exterior, em meio a processos eleitorais locais. Na Nova Caledônia, território francês onde a mineradora tem uma mina de níquel, uma onda de protestos estourou em abril, após mais um vazamento de efluentes ácidos na unidade, no Sul do arquipélago. O acidente, que matou cerca de mil peixes, deu munição à agitação política. No mês seguinte, foram eleitos novos membros do Congresso, que decidirão sobre o referendo que trata da possível independência em relação à França. Veículos e edifícios da Vale foram incendiados, interrompendo a produção por três semanas. A empresa atua na Nova Caledônia em parceria com companhias japonesas e um pool de províncias do arquipélago. No Peru, onde haverá eleições municipais em outubro, a Vale é acusada de não tomar os devidos cuidados no embarque de fosfato (matéria-prima para fertilizantes), em seu terminal na Baía de Sechura, Nordeste do país, o que colocaria em risco o meio ambiente e a atividade pesqueira. A Vale opera no país por meio da subsidiária Miski Mayo, que tem a americana Mosaic e a japonesa Mitsui como sócias. Copyright Grupo de Diarios Amyeacute;rica-GDA/O Globo/Brasil. Todos los derechos reservados. Prohibido su uso o reproducciyoacute;n en Brasil © NoticiasFinancieras - © GDA- Agencia Globo - All rights reserved Sem bola de cristal  Estudos tentam estimar resultado de eleições no país Antônio Gois e Carolina Benevides opais@oglobo.com.br Tradição nas eleições presidenciais dos Estados Unidos, modelos que analisam as intenções de voto para estimar o resultado das eleições começam a aparecer no Brasil. Para este ano, embora o país tenha menos tradição estatística e os cientistas políticos ainda se mostrem cautelosos e não sejam tão assertivos, os estudos têm analisado séries históricas para estimar quem vencerá. Cientistas políticos e professores da FGV-Rio, Cesar Zucco e Daniela Campello criaram um modelo que se baseia em algumas variáveis estruturais. Entre elas estão a série histórica de popularidade dos presidentes e a economia, destacando-se que ""variáveis econômicas internacionais afetam fortemente a economia doméstica, que por sua vez influencia o eleitor"". - O modelo não é para prever, mas para entender um conjunto de eleições - diz Zucco, fazendo a ressalva de que, ""ainda que as eleições sejam realmente previsíveis por fatores estruturais, não quer dizer que a política não importe"", já que as preferências dos eleitores variam ao longo das campanhas. Coautora do modelo, Daniela Campello diz que ""presidentes sul-americanos têm chance bastante alta de serem reeleitos ou de eleger seus sucessores em períodos em que o cenário externo é favorável"". - A chance de perder é alta quando o cenário é desfavorável. Isso acontece porque eleitores percebem que a economia vai bem e votam no governo. O que eles não sabem, no entanto, é que grande parte da razão de a economia ir bem ou mal depende de fatores que estão fora do controle do governo - explica ela. Por isso, diz a cientista política, muitas vezes os eleitores punem presidentes ""azarados"", que governam em cenários desfavoráveis, e premiam os ""sortudos"", que governam em cenários favoráveis. - No Brasil, em particular, a variação de preços de commodities e de juros americanos explica quase 70% da variação da popularidade dos presidentes, em uma série mensal que vai de Sarney a Dilma. Daniela explica que o fenômeno acontece por conta do papel do Brasil na economia mundial: - O país é exportador de commodities e com baixa poupança interna. Daí, é extremamente vulnerável a variações no preço das commodities e das taxas de juros americanos. Ao comentar seu modelo, Zucco conta que, partindo da análise da série histórica, a presidente Dilma Rousseff (PT) já estaria, há algum tempo, abaixo do que seu modelo estima: - Nosso modelo previa uma popularidade mais alta neste momento, que cairia suavemente até as eleições, até por volta de 40%, 45%. E embora popularidade não se traduza em voto diretamente, evidências indiretas sugeririam uma votação semelhante à popularidade. Então, seria uma eleição competitiva, mas com grande probabilidade de vitória do governo. No entanto, mesmo com a queda na popularidade - a última pesquisa Ibope aponta que 31% dos eleitores consideram seu governo bom ou ótimo - Zucco estima que a popularidade de Dilma deve crescer até outubro. Mas há fatores difíceis de prever ou explicar, como os protestos: - Junho de 2013 é bastante difícil de entender. A popularidade não vinha caindo antes da crise. Então, embora sempre se possa dizer que havia uma insatisfação latente, não há evidência nenhuma de que isso era realmente verdade. Com os protestos, a popularidade despencou, o que é intrigante porque eles não eram exatamente focados na presidente. Assim, parecem ter sido causa e não consequência de uma queda de popularidade. Também cientista político, Jairo Nicolau criou um modelo a partir das pesquisas de intenção de votos e dos resultados das eleições presidenciais de 2006 e 2010. As variáveis levam em consideração, por exemplo, as taxas de abstenção e de votos em branco e nulos. - É difícil fazer projeção no Brasil com a precisão que fazem nos Estados Unidos. É a nossa sétima eleição, e o sistema partidário aqui é diferente do deles, que já têm dados mais consistentes. Nossa tentativa de criar esses modelos no Brasil ainda está engatinhando. Aqui você pode até conhecer matemática, mas a política é mais complicada. Nos EUA, em 2012, quando o presidente Barack Obama tentava ser reeleito, o estatístico Nate Silver, que se tornou colunista do ""The New York Times"", criou um modelo a partir das pesquisas de opinião, comparando-as com os resultados em cada estado americano. Por conta disso, cravou que Obama tinha mais de 90% de chance de se reeleger. Por aqui, Nicolau tem, a cada pesquisa divulgada, feito ajustes em seu modelo: - Como não temos uma base de dados tão ampla como a dos EUA, há um pouco de aposta também, já que conheço a política brasileira. Sei, por exemplo, que aqui os partidos contam pouco, mas que há um grupo de eleitores, os petistas, que vota no partido. Nos EUA, as pessoas são republicanas ou democratas. De acordo com Nicolau, a última previsão, feita em maio, apontava o seguinte: Dilma, 38%; Aécio Neves (PSDB), 29%; Eduardo Campos (PSB), 15%; outros, 7%; brancos e nulos, 11%. - Essa estimativa mostra que as surpresas ficam dentro de um campo. Por exemplo, por mais que haja essa loucura de alianças estaduais, isso não vai alterar a ida de Dilma ao segundo turno. No âmbito nacional, a eleição fica mesmo entre PT e PSDB, e já se pode dizer que a Dilma não vai ter 15% dos votos em São Paulo e que nem o PSDB vai ter 8% dos votos lá. Então, por mais que mexam nos estados, isso não mexe no quadro final. Segundo o cientista político, a ""probabilidade de ter segundo turno é de 90%"": - E de ser o Aécio, no segundo turno com a Dilma, é de 80%. Além disso, já é possível dizer que não acredito que haja uma explosão de votos em branco e nulo. Acompanho-os há anos, e com a economia boa, com ela ruim, com maior ou menor grau de insatisfação, eles nunca subiram tanto. Ainda que pesquisas mostrem hoje um aumento grande, acredito que fiquem na margem histórica. Diretor do Instituto Análise, Alberto Carlos Almeida também divulgou este ano um estudo que, ao analisar o resultado de 104 eleições estaduais e presidenciais, identificou que há patamares de aprovação de governantes que deixam a reeleição mais ou menos provável. O trabalho de Almeida revela que houve reeleição em todos os casos em que o governante chegou ao pleito com índice de ótimo ou bom superior a 46%. Por outro lado, todos os que registraram percentuais inferiores a 34% foram derrotados. Considerando esse cenário, as chances de Dilma hoje seriam pequenas, pois sua aprovação é de 31%. Mas, como as eleições serão apenas em outubro e o horário eleitoral nem começou, o que importa verificar é o percentual de aprovação de Dilma às vésperas da eleição. Copyright Grupo de Diarios Amyeacute;rica-GDA/O Globo/Brasil. Todos los derechos reservados. Prohibido su uso o reproducciyoacute;n en Brasil © NoticiasFinancieras - © GDA- Agencia Globo - All rights reserved Extremistas judeus presos após morte de adolescente palestino  A polícia israelense prendeu seis suspeitos do assassinato de um adolescente palestino, sequestrado na noite de terça-feira em Jerusalém Oriental antes de ser queimado vivo, enquanto o primeiro-ministro israelense, Benjamin Netanayhu, pediu calma diante do risco de uma escalada de violência na Faixa de Gaza. ""As pessoas presas em relação a este caso pertencem, aparentemente, a um grupo judeu extremista"", declarou à AFP um dirigente israelense que não quis ser identificado. O Shin Beth, a agência de segurança doméstica, confirmou apenas a detenção e o interrogatório de ""vários suspeitos judeus"", enquanto o ministro de Segurança Pública, Yitzhak Aharonovich, informou que se tratava de seis ""jovens"". O premiê Netanyahu prometeu que ""todo o peso da lei recairá sobre os autores deste crime horrível"". ""No que diz respeito à morte do adolescente de Shuafat, a pista principal da investigação é a de um crime por motivos nacionalistas"", afirmou à AFP Louba Samri, porta-voz da polícia. Mohammed Abu Khder, de 16 anos, foi sequestrado na quarta-feira em Shuafat, um bairro de Jerusalém Oriental. Seu corpo queimado foi achado horas mais tarde em uma floresta a oeste de Jerusalém, em um ataque atribuído pelos palestinos aos israelenses extremistas como vingança pela morte de três adolescentes israelenses dias antes. Os médicos legistas encontraram indícios de fumaça em seus pulmões, o que significa que ele estava vivo quando foi queimado, informou a agência Maan, citando o procurador-geral palestino Mohammed Aluweiwi. Abu Khder também apresentava um ferimento na cabeça, mas que não causou sua morte, acrescentou Aluweiwi. Os palestinos acusam os judeus extremistas de ter matado o jovem em represália ao sequestro e assassinato de três jovens israelenses na região de Hebrón (Cisjordânia), que Israel atribuiu ao movimento islamita Hamas. ""Por que levaram quatro dias? Nós entregamos fotos e vídeos de segurança para a polícia, por que essa demora?"", questionou, por sua vez, o pai do adolescente morto, segundo a agência de notícias Walla. Seu sepultamento foi celebrado na sexta-feira em clima de grande tensão, marcado pelos confrontos em Jerusalém oriental, que se estenderam um dia depois às localidades árabes do norte de Israel. = Não atirei pedras = Durante a noite, a polícia israelense deteve 35 manifestantes, a metade menor de idade, na região da Galileia (norte), quando protestavam contra o assassinato do jovem palestino. Em Nazaré, a maior cidade árabe de Israel, e em Tamra, ocorreram novos incidentes neste domingo. A polícia anunciou a detenção de 16 manifestantes. Para o deputado árabe israelense Agu Agbaria, os protestos dos últimos dias são ""uma resposta à política governamental para os cidadãos árabes"", contra ""a discriminação antiárabe no trabalho, na educação e em outros setores"". Os árabes israelenses, descendentes dos 160 mil palestinos que ficaram em suas terras após a criação do Estado de Israel, em 1948, são hoje em dia mais de 1,4 milhão de pessoas, 20% da população total israelense. A tensão também se fez notar nas redes sociais, onde abundaram de um lado e de outro os apelos à vingança. Um vídeo sobre a surra de dois guardas fronteiriços israelenses de Jerusalém oriental neste jovem palestino semiconsciente suscitou grande indignação. Os Estados Unidos condenaram o ""uso excessivo da força"" contra o jovem, um cidadão americano, e pediu uma ""investigação rápida, transparente e confiável"". O jovem é Tarek Abu Jdeir, de 15 anos, primo do jovem palestino assassinado. Depois de detê-lo, um tribunal de Jerusalém o condenou à prisão domiciliar durante nove dias por apedrejar supostamente policiais durante protestos em Shuafat. ""Eu estava observando a manifestação, ouvi gritos e vi as pessoas corrente em frente a alguns policiais. Também comecei a correr, mas caí e me agarraram, e passaram a me bater"", contou Tariq, com o rosto ainda inchado. ""Dois policiais me atacaram, e, enquanto me batiam, desmaiei. Depois fui ao hospital, e dali para a prisão"", relatou. ""Eu não atirei pedras. Só estava olhando"", insistiu Jdeir. O ministério da Justiça israelense abriu uma investigação interna sobre o incidente, que qualificou de ""grave"". O presidente palestino, Mahmud Abbas, pediu neste domingo às Nações Unidas a criação de uma comissão de investigação sobre ""os crimes terroristas israelenses"". - Drones matam palestinos na Faixa de Gaza - Drones israelenses mataram cinco palestinos nas últimas horas na Faixa de Gaza, após uma série de disparos do território palestino contra o sul de Israel. Na noite de domingo, dois combatentes palestinos morreram e um terceiro ficou ferido no ataque de um avião sem piloto contra uma posição ao leste do campo de refugiados de Bureij, no centro do território palestino, revelou à AFP um porta-voz dos serviços de urgência de Gaza, Achraf al-Qoudra. As vítimas faziam parte de um grupo armado, segundo testemunhas. O Exército hebreu confirmou ""ter conseguido impedir um outro ataque contra Israel ao atingir terroristas envolvidos nos disparos de foguetes a partir do centro da Faixa de Gaza"". Na madrugada desta segunda-feira, um drone matou mais três palestinos e feriu outros dois ao leste de Rafah, no sul da Faixa de Gaza. Uma testemunha disse que os mortos eram militantes e os feridos, civis. Segundo as Brigadas Ezzedine al-Qassam, braço armado do Hamas, seis de seus membros foram mortos no ataque contra Rafah, mas a informação não pôde ser confirmada pelos serviços de emergência. Ao menos 25 foguetes e disparos de morteiro caíram em Israel neste domingo, sem deixar vítimas, assinalou o Exército. sy-dar/agr/cn-mvv/lr"
25,Agence France Presse -- Portuguese,"July 7, 2014",Risco de conflito generalizado entre Israel e Hamas,,,PORTUGUESE; PORTUGUÊS,"Palestinian Territory, Occupied",,,,Boletim de noticías,616 palavras,"July 7, 2014","GAZA, Territórios palestinos 07 Jul 2014",SUBJECT:,"O confronto entre Israel e Hamas corre o risco de se transformar em um conflito generalizado após a morte de pelo menos sete combatentes palestinos em Gaza, num momento em que aumentam os distúrbios após o assassinato de um adolescente palestino por extremistas judeus. Quatro ativistas do braço militar do Hamas, que governa a Faixa de Gaza, morreram em um ataque israelense contra um túnel em Rafah, ao sul do território, segundo várias testemunhas e os serviços de emergência locais. Outros dois membros das brigadas Ezedin al-Qassam desapareceram. A imprensa israelense atribuiu o incidente a uma explosão de origem indeterminada. A região tem muitos túneis que servem para o contrabando a partir do Egito, assim como galerias subterrâneas usadas por comandos para se infiltrar por trás das linhas israelenses ou lançar foguetes. Um combatente palestino faleceu pelos ferimentos sofridos em outro ataque israelense em um campo de treinamento das brigadas de Al-Qassam em Rafah. O exército israelense indicou em um comunicado que havia atacado ""nove posições terroristas e pontos de lançamento de foguetes na Faixa de Gaza"". Desde a noite de domingo, ao menos 14 projéteis atingiram o sul de Israel, um dos quais feriu levemente um militar e provocou danos materiais. Um dos foguetes atingiu os bairros periféricos da cidade de Beersheva, a capital do deserto de Neguev, a 50 km da Faixa de Gaza, sem deixar vítimas. O primeiro-ministro, Benjamin Netanyahu, se comprometeu a ""fazer o necessário para recuperar a paz e a segurança"" no sul de Israel. Mas convocou seu governo a se abster de declarações incendiárias para evitar um confronto generalizado. ""A experiência nos demonstrou que, num momento como esse, devemos agir de forma responsável e com a cabeça fria para nos abster de declarações duras e impetuosas"", declarou Netanyahu aos seus ministros. Esta linha prudente gerou divergências dentro da coalizão conservadora. O ministro das Relações Exteriores, Avigdor Lieberman, um falcão ultranacionalista, anunciou nesta segunda-feira o fim da aliança com o partido Likud do primeiro-ministro, mas sem abandonar o governo. Extremistas judeus confessam assassinato Três dos seis israelenses detidos pelo sequestro e assassinato na semana passada de um adolescente palestino confessaram o crime, indicou nesta segunda-feira uma fonte próxima ao caso. ""Três dos seis suspeitos detidos confessaram ter assassinado e queimado Mohamed Abu Khder, e realizaram uma reconstituição do crime"" diante dos policiais, declarou à AFP a fonte, que pediu o anonimato. O crime provocou novos episódios de violência durante a noite. ""Cerca de 110 pessoas foram detidas durante a noite por perturbar a ordem pública, lançar pedras, destruir mobiliário urbano e atacar as forças de ordem"", indicou à AFP Luba Samri, um porta-voz da polícia. A maioria dos incidentes ocorreu no ""Triângulo"", nome da região da Galileia onde se localizam as cidades de maioria árabe. Em Nahf e Nazaré, manifestantes encapuzados incendiaram pneus e bloquearam várias ruas. As revoltas se converteram em protestos antirracistas, já que a minoria árabe de Israel, cerca de 160.000 palestinos que permaneceram em suas terras após a criação do Estado hebreu, em 1948, denunciam há décadas discriminações no emprego e na educação. Também ocorreram incidentes deste tipo, com 12 detidos, no sul de Israel e nos arredores de Beersheva, onde vive uma importante comunidade beduína, indicou a polícia. Em Hadera (norte de Israel), centenas de pessoas participaram em uma manifestação antirracista na noite de domingo, que se encontrou com um protesto da extrema direita israelense. A polícia dispersou os dois movimentos e deteve 45 pessoas. bur-agr/hj/pop/js/ma"
26,AE Noticiário,11 Julho 2014,Carvalho aposta em 'fracasso' de protestos no domingo,,Tânia Monteiro,PORTUGUESE; PORTUGUÊS,,GERAL,Brasília,FASTNEWS,Boletim de notícias,448 palavras,"July 11, 2014",,,"O Palácio do Planalto manterá o reforço na segurança de Brasília, Belo Horizonte, São Paulo e Rio de Janeiro neste domingo, 13, depois da final da Copa, apesar de dispor de informações indicando que serão esvaziadas as manifestações de rua programadas por grupos na internet. A ordem é evitar violência e destruição de patrimônio. O ministro-chefe da Secretaria-Geral da Presidência, Gilberto Carvalho, classificou como ""um lixo"" o vídeo de convocação do Anonymus para a manifestação, que será ""um redondo fracasso"", em sua avaliação. Gilberto Carvalho, que já havia pedido ""bom senso"" e ""cabeça fria"" aos manifestantes e para que as pessoas evitassem se contaminar com mobilizações movidas pela decepção com a derrota vergonhosa do Brasil para a Alemanha, disse que tem ""plena convicção que a convocatória para domingo será um redondo fracasso, com presença de poucos representantes deste tipo de juventude engomadinha"". Para o ministro, esta é uma ""convocação covarde e anônima, com bico grande e coragem pequena de assumir o que faz"". Indignado com a forma como a convocação está sendo realizada, o ministro Gilberto acrescentou que este vídeo foi produzido por quem ""não tem coragem de assinar o que faz, e, no seu anonimato, mostra, de novo, o oportunismo de conservadores, tal como aconteceu em junho, tentando surfar na onda das mobilizações para fazer uma campanha anti-PT, anti governo"". O ministro reiterou que acredita no fracasso da manifestação. Segundo o governo, os Centros de Coordenação de Defesa de Área criados para atuar na segurança durante a Copa, estão compartilhando informações e acompanhando atentamente todo e qualquer dado sobre os protestos. No caso de Brasília, onde a manifestação está prevista para ser realizada na Praça dos Três Poderes, a ideia é reforçar o policiamento do Palácio do Planalto, do Supremo Tribunal Federal e até mesmo do Congresso, para evitar qualquer possibilidade de destruição do patrimônio público, como houve no ano passado, quando o Itamaraty foi atingido e teve vidraças quebradas. No caso do Palácio do Planalto, sempre que há manifestações, há reforço na segurança não só da Polícia Militar do DF, mas também da Polícia do Exército, além dos próprios seguranças da Presidência. Na frente do Planalto, o Gabinete de Segurança Institucional mantém duas fileiras de grades, para impedir o avanço de manifestantes. Perguntado sobre o reforço de segurança, o GSI afirmou que ""os eventos que possam comprometer a segurança da Copa do Mundo têm sido acompanhados pelo Sistema Brasileiro de Inteligência e difundidos, em momento oportuno, aos diferentes órgãos de segurança envolvidos"". Não indica, no entanto, que tipo de ação será executada."
